{
  "$schema": "https://json-schema.org/draft/2020-12/schema",
  "title": "config/release.json",
  "description": "The packages, manifests and Go modules that a release tag covers, read by scripts/kit/release.mjs.",
  "type": "object",
  "required": [
    "schema",
    "repositoryUrl",
    "changelog",
    "packages",
    "manifests",
    "notReleased",
    "goModules"
  ],
  "additionalProperties": false,
  "properties": {
    "schema": {
      "type": "integer",
      "const": 1
    },
    "repositoryUrl": {
      "description": "The URL of the repository; the notes of a release that is too long link CHANGELOG.md below it.",
      "type": "string",
      "pattern": "^https://[^/]+/[^/]+/[^/]+$"
    },
    "changelog": {
      "description": "The change log whose section `## X.Y.Z` is the notes of the release.",
      "type": "string",
      "pattern": "^[^/][^\\\\]*\\.md$"
    },
    "changelogTranslations": {
      "description": "Further change logs that must hold the section `## X.Y.Z`.",
      "type": "array",
      "items": {
        "type": "string",
        "pattern": "^[^/][^\\\\]*\\.md$"
      }
    },
    "checks": {
      "description": "The check runs of the tagged commit that must have concluded success; push-gate and ci-passed when absent.",
      "type": "array",
      "minItems": 1,
      "items": {
        "type": "string",
        "pattern": "^[^\\s]+$"
      }
    },
    "packages": {
      "description": "The packages that a tag vX.Y.Z releases as one archive each; a wheel is released as its PEP 427 wheel.",
      "type": "array",
      "items": {
        "type": "object",
        "required": [
          "kind",
          "directory",
          "name"
        ],
        "additionalProperties": false,
        "properties": {
          "kind": {
            "type": "string",
            "enum": [
              "npm",
              "composer",
              "wheel"
            ]
          },
          "directory": {
            "description": "The directory of the package relative to the repository root; . is the root.",
            "type": "string",
            "pattern": "^(\\.|[^/\\\\][^\\\\]*[^/\\\\])$"
          },
          "name": {
            "type": "string",
            "pattern": "^(@[a-z0-9._-]+/)?[a-z0-9._-]+(/[a-z0-9._-]+)?$"
          }
        }
      }
    },
    "manifests": {
      "description": "Each manifest whose version a tag vX.Y.Z sets, with how the tag releases it: archive, version or git-tag.",
      "type": "object"
    },
    "notReleased": {
      "description": "Each tracked manifest that no tag releases, with the reason.",
      "type": "object"
    },
    "goModules": {
      "description": "Each Go module by its directory (`.` for the repository root) with its module path.",
      "type": "object"
    },
    "buildBackend": {
      "description": "The build backend of the wheel packages: the exact requirement of the wheel that a build uses, and the sha256 of that wheel from its PyPI release. release-backend.mjs downloads it into var/tools/wheels with the digest checked.",
      "type": "object",
      "required": [
        "requirement",
        "sha256"
      ],
      "additionalProperties": false,
      "properties": {
        "requirement": {
          "type": "string",
          "pattern": "^[A-Za-z0-9._-]+==\\d+(\\.\\d+)*$"
        },
        "sha256": {
          "type": "string",
          "pattern": "^[0-9a-f]{64}$"
        }
      }
    },
    "consumers": {
      "description": "The consumer projects that install the archives of a tag outside the repository (release-consumer.mjs); one per package kind that has packages. A wheel has no committed project; its lock is named per package.",
      "type": "object",
      "additionalProperties": false,
      "properties": {
        "npm": {
          "type": "object",
          "required": [
            "directory",
            "smoke"
          ],
          "additionalProperties": false,
          "properties": {
            "directory": {
              "description": "The directory of the committed manifest and lock of the consumer project.",
              "type": "string",
              "pattern": "^[^/\\\\][^\\\\]*[^/\\\\]$"
            },
            "smoke": {
              "description": "Each package that the consumer installs, with the command (an array of strings) that checks it in the installed project.",
              "type": "object"
            }
          }
        },
        "composer": {
          "type": "object",
          "required": [
            "directory",
            "smoke"
          ],
          "additionalProperties": false,
          "properties": {
            "directory": {
              "description": "The directory of the committed manifest and lock of the consumer project.",
              "type": "string",
              "pattern": "^[^/\\\\][^\\\\]*[^/\\\\]$"
            },
            "smoke": {
              "description": "Each package that the consumer installs, with the command (an array of strings) that checks it in the installed project.",
              "type": "object"
            }
          }
        },
        "wheel": {
          "type": "object",
          "required": [
            "smoke",
            "lock",
            "polyspec"
          ],
          "additionalProperties": false,
          "properties": {
            "smoke": {
              "description": "Each wheel package, with the command (an array of strings) that checks it in the installed virtual environment.",
              "type": "object"
            },
            "lock": {
              "description": "Each wheel package with the path of its PEP 751 lock (pylock.toml or pylock.<name>.toml): the registry packages and the polyspec archives that the wheel depends on, installed with their hashes. A sibling (another wheel package of this configuration, released by the same tag) is not held here; a Requires-Dist names it by its URL of the release without a hash.",
              "type": "object"
            },
            "polyspec": {
              "description": "Each polyspec distribution that a wheel may depend on, with the URL of its GitHub repository; a Requires-Dist names it only by a direct reference to its release asset with a sha256 fragment. A wheel package of this configuration is a sibling and is never declared here.",
              "type": "object"
            }
          }
        }
      }
    },
    "proof": {
      "description": "What the release proof (release-proof.mjs) installs from the tag besides the archives.",
      "type": "object",
      "required": [
        "gitTag"
      ],
      "additionalProperties": false,
      "properties": {
        "gitTag": {
          "description": "Each manifest with the mode git-tag, with { kind: rust, name, smoke } for its install from the tag.",
          "type": "object"
        }
      }
    }
  }
}
